{
  "manifestVersion": "run-manifest-v1.0.0",
  "run": {
    "runId": "run-example",
    "status": "identity_unresolved",
    "stage": "review",
    "snapshot": { "descriptorVersion": "export-snapshot-v1.0.0", "authoritativeStateSha256": "aaaaaaaaaaaaaaaaaaaaaaaaaaaaaaaaaaaaaaaaaaaaaaaaaaaaaaaaaaaaaaaa" },
    "relevantTimestamps": { "mappingProposalCreatedAt": null, "firstIdentityDecisionAt": null, "lastIdentityDecisionAt": null, "policyConfiguredAt": null, "lastResolutionAt": null }
  },
  "sourceDatasets": {
    "A": { "side": "A", "datasetId": "dataset-a", "originalFilename": "a.csv", "sha256": "bbbbbbbbbbbbbbbbbbbbbbbbbbbbbbbbbbbbbbbbbbbbbbbbbbbbbbbbbbbbbbbb", "rowCount": 1, "profileSchemaVersion": "1.0.0" },
    "B": { "side": "B", "datasetId": "dataset-b", "originalFilename": "b.csv", "sha256": "cccccccccccccccccccccccccccccccccccccccccccccccccccccccccccccccc", "rowCount": 1, "profileSchemaVersion": "1.0.0" }
  },
  "semanticMapping": { "mappingVersion": "confirmed-mappings-v1", "confirmedMappings": [], "ai": null },
  "candidateGeneration": { "candidateEngineVersion": "candidate-engine-v0.4.0", "blockingNormalizationVersion": "blocking-normalization-v0.1.0", "candidateConfigVersion": "candidate-engine-v0.4.0", "candidateConfigAvailability": "not_retained", "evidencePlanVersion": "evidence-plan-v1.0.0", "evidencePlanSha256": "eeeeeeeeeeeeeeeeeeeeeeeeeeeeeeeeeeeeeeeeeeeeeeeeeeeeeeeeeeeeeeee", "evidencePlan": {} },
  "matcher": { "featurePipelineVersion": "feature-pipeline-v0.2.0", "matcherVersion": "explainable-matcher-v0.3.0", "matcherConfigVersion": "matcher-config-v0.3.0", "matcherConfig": {}, "scoreSemanticsVersion": "explainable-matcher-v0.3.0" },
  "identity": { "systemEstablishedLinkCount": 0, "humanSameCount": 0, "humanDifferentCount": 0, "pendingCount": 1, "deferredCount": 0, "collisionRelatedCount": 0, "humanBatchPairCount": 0, "reviewSignatureVersion": "review-signature-v1.0.0" },
  "survivorship": { "policySchemaVersion": "survivorship-policy-v1", "policyVersion": null, "configuredFieldPolicies": [], "manualResolutionCount": 0, "ruleGeneratedResolutionCount": 0, "keepBothCount": 0, "unresolvedConflictCount": 0 },
  "evaluation": { "applicable": false, "snapshotId": null, "snapshotVersion": null, "reason": "No versioned evaluation snapshot is attached to this ordinary product run." },
  "export": { "artifacts": [{ "kind": "reconciliation_report", "version": "reconciliation-export-v3.0.0", "filename": "samewise-run-example-reconciliation.csv", "mediaType": "text/csv; charset=utf-8", "sha256": "dddddddddddddddddddddddddddddddddddddddddddddddddddddddddddddddd", "byteLength": 123 }] }
}
